{
  "id": "skyville-401",
  "title": "스카이빌",
  "subtitle": "보문역 1번 출구 1분거리(58m) 초역세권 · 풀옵션 원룸",
  "heroLead": "보문역 1번 출구에서 도보 1분(58m) 거리에 위치한 깔끔한 풀옵션 원룸입니다. LH·SH·중기청 등 전세대출이 가능하며, 융자 없는 안전한 집이라 안심하고 계약하실 수 있습니다. 집주인이 대기업·은행권에 재직 중이라 더욱 신뢰할 수 있는 매물입니다.",
  "heroPhoto": {
    "src": "photos/hero-1.jpg",
    "alt": "스카이빌 방 전체 전경(침대, TV, 주방까지 한눈에 보이는 전경)",
    "aspectRatio": "4/3"
  },
  "summary": {
    "deposit": "8,500만 원",
    "monthlyRent": "32만 원",
    "maintenanceFee": "8만 원, 별도",
    "parkingFee": "별도",
    "floor": "4층 / 총 7층",
    "areaPyeong": "약 6평",
    "moveInDate": "2026년 8월 21일 (일정 협의 가능)",
    "loanEligibility": "LH·SH·중기청 가능"
  },
  "sections": [
    {
      "key": "room",
      "heading": "화장실·세탁공간이 분리된 깔끔한 원룸",
      "body": [
        "방 전체는 화이트톤으로 정리되어 있고, 화장실과 세탁 공간이 별도로 분리되어 있어 생활 동선이 편합니다. 창을 통해 채광이 들어오고, 침대·TV·에어컨이 자연스럽게 배치되어 있어 바로 입주해 생활하실 수 있는 구조입니다.",
        "냉장고(247L), 세탁기, 에어컨, 옷장, 신발장 등이 옵션으로 포함되어 있어 별도의 가전 구매 부담 없이 이사할 수 있습니다."
      ],
      "photos": [
        {
          "src": "photos/room-wide-1.jpg",
          "alt": "스카이빌 방 전체 전경",
          "aspectRatio": "4/3"
        },
        {
          "src": "photos/room-wide-2.jpg",
          "alt": "침대, 에어컨, TV가 배치된 방 내부",
          "aspectRatio": "2.1/1"
        },
        {
          "src": "photos/room-laundry-1.jpg",
          "alt": "옵션으로 제공되는 세탁기",
          "aspectRatio": "3/4"
        }
      ],
      "keywords": ["풀옵션", "화장실·세탁공간 분리", "약 6평"]
    },
    {
      "key": "kitchen",
      "heading": "247L 대용량 냉장고를 갖춘 싱크대",
      "body": [
        "싱크대와 냉장고가 나란히 배치되어 있고, 냉장고는 247리터로 1인 가구가 쓰기에 넉넉한 크기입니다. 가스레인지도 함께 설치되어 있어 간단한 조리가 가능합니다.",
        "수납장이 상하로 구성되어 있어 조리도구와 식자재를 정리해 두기 좋고, 전체적으로 화이트 톤이라 좁지 않고 밝은 느낌을 줍니다."
      ],
      "photos": [
        {
          "src": "photos/kitchen-1.jpg",
          "alt": "싱크대와 가스레인지가 있는 주방",
          "aspectRatio": "3/4"
        },
        {
          "src": "photos/kitchen-2.jpg",
          "alt": "247L 대용량 냉장고",
          "aspectRatio": "4/3"
        }
      ],
      "keywords": ["247L 냉장고", "가스레인지", "수납장"]
    },
    {
      "key": "bathroom",
      "heading": "깔끔하게 관리되는 욕실",
      "body": [
        "화장실은 항상 깔끔하게 유지되고 있으며, 세면대와 양변기가 여유 있게 배치되어 있습니다.",
        "고장이나 노후 부분이 생기면 바로 교체해 드리기 때문에, 입주 후에도 관리에 대한 걱정 없이 지내실 수 있습니다."
      ],
      "photos": [
        {
          "src": "photos/bathroom-1.jpg",
          "alt": "세면대와 양변기가 있는 화장실",
          "aspectRatio": "3/4"
        },
        {
          "src": "photos/bathroom-2.jpg",
          "alt": "깔끔하게 관리되는 욕실 내부",
          "aspectRatio": "3/4"
        }
      ],
      "keywords": ["즉시 교체 관리", "세면대 · 양변기"]
    },
    {
      "key": "security",
      "heading": "삼중 보안장치로 안심하고 지낼 수 있는 집",
      "body": [
        "세대 현관에는 도어락이 설치되어 있고, 1층 공동현관 잠금장치와 CCTV까지 더해져 삼중으로 보안을 갖추고 있습니다.",
        "대로변에 위치해 있어 늦은 시간 귀가할 때도 주변이 어둡지 않고 사람들의 통행이 있어 체감 안전도가 높습니다."
      ],
      "photos": [
        {
          "src": "photos/doorlock-1.jpg",
          "alt": "세대 현관 도어락 클로즈업",
          "aspectRatio": "3/4"
        }
      ],
      "keywords": ["도어락", "공동현관 잠금장치 · CCTV", "대로변 위치"]
    },
    {
      "key": "amenities",
      "heading": "엘리베이터와 주차장을 갖춘 7층 건물",
      "body": [
        "건물에 엘리베이터가 설치되어 있어 짐이 많은 날에도 계단을 오르내릴 필요가 없습니다. 주차장도 마련되어 있어 차량이 있는 분들도 편리하게 이용하실 수 있습니다(주차 여건에 따라 상이할 수 있음).",
        "복도는 넓고 항상 깨끗하게 관리되고 있어, 매일 드나드는 공간에서도 쾌적함을 느끼실 수 있습니다."
      ],
      "photos": [
        {
          "src": "photos/elevator-1.jpg",
          "alt": "건물 엘리베이터 입구",
          "aspectRatio": "3/4"
        },
        {
          "src": "photos/parking-1.jpg",
          "alt": "건물 주차장 공간",
          "aspectRatio": "1/1"
        },
        {
          "src": "photos/corridor-1.jpg",
          "alt": "넓고 깨끗한 건물 복도",
          "aspectRatio": "4/3"
        },
        {
          "src": "photos/building-view-1.jpg",
          "alt": "건물 외부 전망",
          "aspectRatio": "3/4"
        }
      ],
      "keywords": ["엘리베이터", "주차 가능", "넓고 깨끗한 복도"]
    },
    {
      "key": "location",
      "heading": "성북천을 곁에 둔 초역세권",
      "body": [
        "6호선 보문역 1번 출구에서 도보 1분(58m) 거리이며, 우이신설선도 함께 이용할 수 있습니다. 편의점, 카페, 주민센터, 이마트 등 생활 편의시설이 가까이 있고, 동대문시장도 대중교통으로 약 10분이면 닿습니다.",
        "밤이 되면 바로 근처 성북천에 러닝이나 산책을 나온 사람들을 많이 볼 수 있습니다. 조명이 밝고 산책로가 깔끔하게 정비되어 있어 반려동물과 함께 걷기에도, 혼자 가볍게 달리기에도 좋습니다. 성북천 주변에는 분위기 좋은 카페들도 있어 야외 테라스에서 시간을 보내기 좋습니다."
      ],
      "photos": [
        {
          "src": "photos/stream-night-1.jpg",
          "alt": "밤에 조명이 켜진 성북천 산책로",
          "aspectRatio": "4/3"
        },
        {
          "src": "photos/stream-night-2.jpg",
          "alt": "성북천을 따라 이어지는 야경과 아파트 단지",
          "aspectRatio": "4/3"
        },
        {
          "src": "photos/stream-night-3.jpg",
          "alt": "성북천 산책로 야경",
          "aspectRatio": "4/3"
        },
        {
          "src": "photos/map-1.png",
          "alt": "보문역 1번 출구에서 1분거리(58m) 위치를 보여주는 지도",
          "aspectRatio": "1.88/1"
        }
      ],
      "keywords": ["보문역 1번 출구 1분거리(58m)", "성북천 산책·러닝", "동대문시장 인접"]
    },
    {
      "key": "fees",
      "heading": "관리비 안내",
      "body": [
        "관리비 8만 원에는 엘리베이터 유지비, 공용 전기, 공용 청소, 정화조, 인터넷·케이블이 포함되어 있습니다. 주차비는 별도입니다."
      ],
      "photos": [
        {
          "src": "photos/corridor-1.jpg",
          "alt": "관리비에 포함되는 공용 복도 공간",
          "aspectRatio": "4/3"
        }
      ],
      "keywords": ["엘리베이터 유지비", "공용 전기·청소", "인터넷·케이블 포함", "주차비 별도"]
    },
    {
      "key": "trust",
      "heading": "안심하고 계약할 수 있는 이유",
      "body": [
        "이 집은 융자가 없는 안전한 매물이며, LH·SH·중기청 전세대출이 100% 가능합니다. 집주인이 대기업·은행권에 재직 중이라는 점도 신뢰를 더합니다."
      ],
      "photos": [
        {
          "src": "photos/doorlock-1.jpg",
          "alt": "안전한 세대 현관 도어락",
          "aspectRatio": "3/4"
        }
      ],
      "keywords": ["융자 없음", "LH·SH·중기청 가능", "집주인 대기업·은행권 재직"]
    }
  ],
  "location": {
    "address": "서울특별시 성북구 보문동2가 82",
    "map": {
      "lat": 37.5828,
      "lng": 127.0195
    },
    "neighborhoodNote": "6호선 보문역 1번 출구 도보 1분(58m), 성북천 산책로 인접"
  },
  "contact": {
    "kakaoId": "ckpark1001",
    "phone": "010-8222-7661",
    "email": "ckpark1001@naver.com"
  },
  "finalCta": {
    "heading": "지금 바로 문의해 보세요",
    "message": "가능하시면 문자로 문의 주시면 감사하겠습니다. 언제든 편하게 연락 주세요.",
    "buttons": [
      { "label": "카톡으로 문의하기", "action": "kakao-copy" },
      { "label": "전화하기", "action": "tel" }
    ]
  },
  "footerNotice": "현재 사진은 같은 구조의 다른 호실 사진입니다."
}
